{
  "clause": "252.204-7008",
  "slug": "252-204-7008",
  "title": "Compliance with Safeguarding Covered Defense Information Controls",
  "category": "cybersecurity",
  "description": "This solicitation provision requires offerors to represent whether they have implemented NIST SP 800-171 security requirements. Offerors must certify their compliance status and identify any security requirements not yet implemented at the time of proposal submission. This representation becomes a material part of the contract award decision.",
  "applicability": "Included in DoD solicitations for contracts that will involve CUI. Offerors must complete this representation as part of their proposal.",
  "keyRequirements": [
    "Certify implementation of NIST SP 800-171 security requirements",
    "Submit System Security Plan (SSP) if not fully compliant",
    "Identify specific controls not yet implemented with remediation timeline"
  ],
  "flowdown": false,
  "relatedNist": [
    "ac-3-1-1",
    "ia-3-5-1",
    "sc-3-13-1"
  ],
  "relatedHubs": [
    "cmmc"
  ],
  "searchTier": "high",
  "faq": [
    {
      "question": "What is DFARS 252.204-7008?",
      "answer": "DFARS 252.204-7008 (Compliance with Safeguarding Covered Defense Information Controls) This solicitation provision requires offerors to represent whether they have implemented NIST SP 800-171 security requirements. Offerors must certify their compliance status and identify any security "
    },
    {
      "question": "Does DFARS 252.204-7008 flow down to subcontractors?",
      "answer": "No, DFARS 252.204-7008 does not flow down to subcontractors. This clause applies only to the prime contractor."
    },
    {
      "question": "When does DFARS 252.204-7008 apply?",
      "answer": "Included in DoD solicitations for contracts that will involve CUI. Offerors must complete this representation as part of their proposal."
    }
  ],
  "practicalExample": "TechSecure Solutions, a mid-size cybersecurity firm with $45M annual revenue, bid on a $12M Air Force contract for network monitoring services. During proposal preparation, their ISSO discovered they had implemented only 98 of 110 NIST SP 800-171 controls—missing 12 critical access control and audit requirements. Rather than falsely certify full compliance, they submitted a detailed System Security Plan identifying the gaps with a 180-day remediation timeline and $320,000 budget. The contracting officer appreciated their transparency and awarded the contract with a condition requiring quarterly compliance reports. TechSecure invested $295,000 in security infrastructure upgrades and achieved full compliance within 150 days. The lesson: honest disclosure with a credible remediation plan often wins over false certification, which could have resulted in contract termination and potential False Claims Act liability exceeding $2.4M in treble damages.",
  "whyItMatters": "This clause triggers whenever DoD solicitations involve Controlled Unclassified Information (CUI), affecting both prime contractors and subcontractors handling defense data. False representations can lead to contract termination, suspension from federal contracting, and False Claims Act violations with penalties up to three times contract value plus $12,537-$25,076 per violation. The clause directly feeds into CMMC 2.0 Level 2 requirements, where NIST SP 800-171 compliance becomes a prerequisite for contract award starting 2025. With DoD's increased focus on supply chain cybersecurity following recent nation-state attacks, contracting officers now scrutinize these representations more rigorously. The 2026 regulatory trend shows heightened enforcement through DCMA cybersecurity assessments and mandatory SPRS score validation, making truthful initial representations critical for long-term contractor viability.",
  "complianceCost": "Initial NIST SP 800-171 implementation ranges from $150,000-$800,000 depending on company size and existing security posture. Small businesses (under $50M revenue) typically spend $200,000-$350,000, while mid-size firms ($50M-$500M) invest $400,000-$600,000. Annual maintenance costs average 15-20% of initial investment, including security monitoring, training, and control testing. Non-compliance remediation adds 25-40% premium due to rushed implementation and potential contract delays. Full compliance typically requires 6-18 months, with smaller organizations achieving faster results through managed security services. Cost drivers include existing IT infrastructure maturity, number of CUI-handling systems, required security tool purchases, and third-party assessment fees ranging $25,000-$75,000.",
  "crossReferences": "This clause establishes the foundational cybersecurity posture required for DFARS 252.204-7012 (Safeguarding Covered Defense Information), which mandates actual NIST SP 800-171 implementation. Compliance directly enables progression to DFARS 252.204-7021 (CMMC Requirements), where NIST SP 800-171 forms the technical baseline for CMMC Level 2 certification. The representation feeds into DFARS 252.204-7019 (SPRS Requirements), requiring ongoing score reporting through DoD's Supplier Performance Risk System. Control families AC (Access Control), AU (Audit and Accountability), and SC (System and Communications Protection) align with CMMC Level 2 practices. Non-compliance triggers enhanced oversight under DFARS 252.204-7020 (NIST SP 800-171 DoD Assessment Requirements) for contracts exceeding $7.5M, creating cascading compliance obligations throughout the contract lifecycle.",
  "procurementGuidance": "This provision appears in Section L of DoD solicitations involving CUI and requires completion during initial proposal submission. Source selection teams evaluate representations as part of responsibility determination, not technical scoring, but false statements can result in immediate proposal rejection. Prepare comprehensive documentation including current NIST SP 800-171 assessment results, implemented control matrix, and detailed POA&M for any gaps. Address representation honestly in your proposal narrative, emphasizing remediation timeline and resource commitment. Submit supporting SSP documentation through the designated secure portal specified in Section L instructions. For competitive procurements, demonstrate cybersecurity maturity through third-party assessment reports and previous DoD contract performance history. Coordinate with your ISSO early in proposal development to ensure accurate representation and avoid last-minute compliance discoveries that could jeopardize proposal submission deadlines.",
  "complianceChecklist": [
    "ISSO conducts comprehensive NIST SP 800-171 gap analysis against all 110 security requirements using DoD's Self-Assessment Handbook.",
    "Legal team reviews contract language to confirm CUI handling requirements and determines if full compliance representation is accurate.",
    "Contracts personnel prepares truthful representation stating current compliance percentage and submits through SAM.gov contractor portal.",
    "ISSO develops detailed System Security Plan (SSP) documenting implemented controls, infrastructure, and security procedures for submission to contracting officer.",
    "IT security team creates Plan of Action and Milestones (POA&M) for any non-implemented controls with specific remediation timelines and cost estimates.",
    "Compliance officer establishes quarterly SPRS score reporting process through DIBNet portal to maintain current status visibility.",
    "Senior management approves remediation budget allocation and assigns executive sponsor for ongoing NIST SP 800-171 compliance program.",
    "Procurement team coordinates with DCMA for potential cybersecurity assessment scheduling if contract value exceeds $7.5M threshold."
  ]
}
